การตกปลาที่แปลกใหม่,ม.ค. ค.ศ. 2016 • คู่รัก,ที่นี่คุณจะได้พลเจอกับการตกปลาด้วย ความสนุกสนานและแปลกใหม่กับกลุ่มเพื่อนๆของคุณ แต่ห้ามเอากลับหรือนำมาปรุงอากหาร,AmazonFishingParkPattayaพทยาไทย,"https://maps.google.com/maps/api/staticmap?&channel=ta.desktop.attraction_review&zoom=12&size=416x722&scale=2&client=gme-tripadvisorinc&format=jpg&sensor=false&language=th_TH&center=12.775920,100.924110&maptype=roadmap&&markers=icon:http%3A%2F%2Fc1.tacdn.com%2F%2Fimg2%2Fmaps%2Ficons%2Ffusion_map%2Fv2%2Fattractions-standard.png|scale:2|12.777781,100.919922|12.767138,100.933350|12.787906,100.955322|12.749869,100.961761&&markers=icon:http%3A%2F%2Fc1.tacdn.com%2F%2Fimg2%2Fmaps%2Ficons%2Ffusion_map%2Fv2%2Fattractions-active-anchor.png|scale:2|12.775920,100.924110&&markers=icon:http%3A%2F%2Fc1.tacdn.com%2F%2Fimg2%2Fmaps%2Ficons%2Ffusion_map%2Fv2%2Frestaurants-standard.png|scale:2|12.786839,100.915695|12.786985,100.915733|12.788110,100.916862|12.771494,100.909012|12.790755,100.928467&map_id=c01884c8146ad115&signature=TpbFKtsPcJAxC7yTcozyJrY4fS8="
สนุกไปแล้วไปอีกคุ้ม,เม.ย. ค.ศ. 2015 • เพื่อนๆ,จากการที่ตระเวนเที่ยวสวนน้ำทุกที่ในประเทศไทยแล้ว ที่นี้ดีที่ค่าตั๋วอาจจะแพงกว่าหลายๆที่แต่รับรองเครื่องเล่นและระบบของสวนน้ำนี้ให้อันดับ1ในใจเลยค่ะ,AmazonFishingParkPattayaพทยาไทย,"https://maps.google.com/maps/api/staticmap?&channel=ta.desktop.attraction_review&zoom=12&size=416x722&scale=2&client=gme-tripadvisorinc&format=jpg&sensor=false&language=th_TH&center=12.775920,100.924110&maptype=roadmap&&markers=icon:http%3A%2F%2Fc1.tacdn.com%2F%2Fimg2%2Fmaps%2Ficons%2Ffusion_map%2Fv2%2Fattractions-standard.png|scale:2|12.777781,100.919922|12.767138,100.933350|12.787906,100.955322|12.749869,100.961761&&markers=icon:http%3A%2F%2Fc1.tacdn.com%2F%2Fimg2%2Fmaps%2Ficons%2Ffusion_map%2Fv2%2Fattractions-active-anchor.png|scale:2|12.775920,100.924110&&markers=icon:http%3A%2F%2Fc1.tacdn.com%2F%2Fimg2%2Fmaps%2Ficons%2Ffusion_map%2Fv2%2Frestaurants-standard.png|scale:2|12.786839,100.915695|12.786985,100.915733|12.788110,100.916862|12.771494,100.909012|12.790755,100.928467&map_id=c01884c8146ad115&signature=TpbFKtsPcJAxC7yTcozyJrY4fS8="
สนุกมากเลย,None,เราไม่เคยตกปลามาก่อน แต่มาที่นี้แล้วไม่เป็นปัญหาเลย ที่นี่ดูแลเราอย่างดีและไปถึงเราก็ได้ตกปลาเร็วมาก สิ่งเดียวที่น่าเสียดายคือฉันเผลอลบรูปที่เราได้ไปถ่ายมาทั้งหมด! เสียใจมาก. สามีฉันติดมันมากเลยล่ะ,AmazonFishingParkPattayaพทยาไทย,"https://maps.google.com/maps/api/staticmap?&channel=ta.desktop.attraction_review&zoom=12&size=416x722&scale=2&client=gme-tripadvisorinc&format=jpg&sensor=false&language=th_TH&center=12.775920,100.924110&maptype=roadmap&&markers=icon:http%3A%2F%2Fc1.tacdn.com%2F%2Fimg2%2Fmaps%2Ficons%2Ffusion_map%2Fv2%2Fattractions-standard.png|scale:2|12.777781,100.919922|12.767138,100.933350|12.787906,100.955322|12.749869,100.961761&&markers=icon:http%3A%2F%2Fc1.tacdn.com%2F%2Fimg2%2Fmaps%2Ficons%2Ffusion_map%2Fv2%2Fattractions-active-anchor.png|scale:2|12.775920,100.924110&&markers=icon:http%3A%2F%2Fc1.tacdn.com%2F%2Fimg2%2Fmaps%2Ficons%2Ffusion_map%2Fv2%2Frestaurants-standard.png|scale:2|12.786839,100.915695|12.786985,100.915733|12.788110,100.916862|12.771494,100.909012|12.790755,100.928467&map_id=c01884c8146ad115&signature=TpbFKtsPcJAxC7yTcozyJrY4fS8="
"""อเมซอนไจแอนท์"" จุดตกปลาที่ยอดเยี่ยมเป็นเจ้าภาพที่ยิ่งใหญ่ขอบคุณ Alf!",มี.ค. ค.ศ. 2020,"เมื่อเร็ว ๆ นี้ไปตกปลาเต็มวันที่ ""Amazon Giant Fishing Fishing"" และมีประสบการณ์ที่ยอดเยี่ยม สิ่งอำนวยความสะดวกได้รับการดูแลอย่างดี wifi และพลังงานที่เหมาะสมอยู่ที่น้ำ ไกด์ของเรา Alf เป็นอัญมณีมีความรู้และเป็นประโยชน์มากและรู้ทุกอย่างเกี่ยวกับสายพันธุ์และสถานที่ตกปลา ปลามีความอุดมสมบูรณ์ก้าวร้าวมากด้วยตะขอที่โค้งงอบางอย่างและไม่สามารถหมุนได้เมื่อถูกตะขอเป็นเวลาที่สนุกมาก นอกจากนี้ยังมีอาหารหลากหลายรายการบนเมนูพร้อมเครื่องดื่มให้บริการเช่นกัน เราจ่ายเงิน 3,000 บาทต่อวันตลอดทั้งวันซึ่งรวมถึงการรับและส่งกลับไปที่โรงแรมเสาตกปลาและเหยื่อ อย่างที่ฉันพูดไปก่อนหน้านี้ Alf เป็นไกด์ของเรามีพื้นเพมาจากสหราชอาณาจักรและเป็นคนสนุกสนาน",AmazonFishingParkPattayaพทยาไทย,"https://maps.google.com/maps/api/staticmap?&channel=ta.desktop.attraction_review&zoom=12&size=416x722&scale=2&client=gme-tripadvisorinc&format=jpg&sensor=false&language=th_TH&center=12.775920,100.924110&maptype=roadmap&&markers=icon:http%3A%2F%2Fc1.tacdn.com%2F%2Fimg2%2Fmaps%2Ficons%2Ffusion_map%2Fv2%2Fattractions-standard.png|scale:2|12.777781,100.919922|12.767138,100.933350|12.787906,100.955322|12.749869,100.961761&&markers=icon:http%3A%2F%2Fc1.tacdn.com%2F%2Fimg2%2Fmaps%2Ficons%2Ffusion_map%2Fv2%2Fattractions-active-anchor.png|scale:2|12.775920,100.924110&&markers=icon:http%3A%2F%2Fc1.tacdn.com%2F%2Fimg2%2Fmaps%2Ficons%2Ffusion_map%2Fv2%2Frestaurants-standard.png|scale:2|12.786839,100.915695|12.786985,100.915733|12.788110,100.916862|12.771494,100.909012|12.790755,100.928467&map_id=c01884c8146ad115&signature=TpbFKtsPcJAxC7yTcozyJrY4fS8="
ตกปลาที่น่าตื่นตาตื่นใจ,ก.ย. ค.ศ. 2019 • คู่รัก,ฉันชอบตกปลาและไม่มีอะไรสนุกไปกว่าการตกปลาที่สวนแห่งนี้ จัดวางอย่างสวยงามด้วยห้องสุขาที่สะอาดร้านอาหารร้านขายปลาพื้นที่ตกปลาในร่มและอาหารอร่อย ทุกสิ่งที่คุณต้องการนั้นมาพร้อมกับอุปกรณ์ตกปลาคุณภาพดี พนักงานให้ความช่วยเหลือมากกว่าและพวกเขาเอาใจใส่และดูแลปลาด้วยเสื่อปลาเปียกสด ต้องถ้าคุณต้องการที่จะจับสิ่งอื่นที่ไม่ใช่ปลาดุกโขง ปลาดุกหางแดงวางการต่อสู้ที่ดี barbel ปลานิลและสิ่งที่ดูเหมือนปิรันย่า วันที่ดีแม้ในพายุฝนตกหนัก,AmazonFishingParkPattayaพทยาไทย,"https://maps.google.com/maps/api/staticmap?&channel=ta.desktop.attraction_review&zoom=12&size=416x722&scale=2&client=gme-tripadvisorinc&format=jpg&sensor=false&language=th_TH&center=12.775920,100.924110&maptype=roadmap&&markers=icon:http%3A%2F%2Fc1.tacdn.com%2F%2Fimg2%2Fmaps%2Ficons%2Ffusion_map%2Fv2%2Fattractions-standard.png|scale:2|12.777781,100.919922|12.767138,100.933350|12.787906,100.955322|12.749869,100.961761&&markers=icon:http%3A%2F%2Fc1.tacdn.com%2F%2Fimg2%2Fmaps%2Ficons%2Ffusion_map%2Fv2%2Fattractions-active-anchor.png|scale:2|12.775920,100.924110&&markers=icon:http%3A%2F%2Fc1.tacdn.com%2F%2Fimg2%2Fmaps%2Ficons%2Ffusion_map%2Fv2%2Frestaurants-standard.png|scale:2|12.786839,100.915695|12.786985,100.915733|12.788110,100.916862|12.771494,100.909012|12.790755,100.928467&map_id=c01884c8146ad115&signature=TpbFKtsPcJAxC7yTcozyJrY4fS8="
เปิดเฉพาะ Amazon Fishing Fishing Park เท่านั้น,ก.พ. ค.ศ. 2019 • คู่รัก,"เมื่อสัปดาห์ที่แล้วฉันได้ไปตกปลาที่ Amazon GIANT Fishing Park

Amazon Fishing Park ถูกปิด ปลาทั้งหมดถูกย้ายไปที่สวนอเมซอนฟิชชิ่ง และยังเป็นหนึ่งในสวนตกปลาไม่กี่แห่งในพัทยาที่เปิดให้บริการในวันอาทิตย์

ทีมเป็นมิตรสุด ๆ การขนส่งรวมอยู่ในค่าเข้าชม 3,500 บาทและแม้ว่าโรงแรมของเราจะอยู่ห่างออกไป 5 กม. เล็ก ๆ น้อย ๆ พวกเขามารับเราโดยไม่มีการพูดคุย

ทะเลสาบเล็กกว่าตัวอย่างเช่นบึงสามพัน แต่สิ่งอำนวยความสะดวกนั้นได้รับการดูแลอย่างดีและสะอาด มีพนักงานสองคนยืนอยู่ข้างๆและสนับสนุนแขกด้วยตาข่ายเหยื่อหรือเครื่องดื่ม คุณสามารถเลือกระหว่างปลาที่ตายแล้วขนมปังผสมและหัวใจไก่สำหรับเหยื่อ ทั้งหมดมีพื้นที่สำหรับแคลิฟอร์เนีย 10 ปาร์ตี้ตกปลา แต่วันนี้มีแค่สองแห่งเท่านั้นมันผ่อนคลายและเงียบสงบมาก อาหารก็ดีเหมือนกัน

ตลอดทั้งวันฉันจับปลาได้ประมาณ 15 ตัว Arapaima ขนาดเล็กปลาดุกหางแดงหลายตัวปลาดุกโขงสองตัว, 3 - 4 Paku (ซึ่งเป็นนักสู้ที่ยากสำหรับขนาดของมัน) และปลาชนิดอื่น ๆ ที่ฉันไม่รู้จักชื่อ ปลาเล็กกว่าที่บึงสามพันที่ใหญ่ที่สุดที่ฉันจับได้ 15 กิโลกรัม แต่ Red Fish Catfish และ Paku กำลังต่อสู้กันอย่างน่าทึ่ง

ในตอนเย็นมีผีเสื้อออกมาดีกว่านำยาขับไล่แมลงของคุณออกไปหากคุณต้องการตกปลาหลังจาก 5 p ม.

โดยรวมแล้วฉันขอแนะนำสวนตกปลาแห่งนี้ถ้าคุณต้องการจับปลาหลากหลายชนิดและอยากมีวันพักผ่อนที่ทะเลสาบ

ถ้าฉันมีข้อเสนอแนะอย่างหนึ่งก็คงจะเป็นการตั้งพัดลมที่กระท่อมไม้ไผ่ดังนั้นความร้อนในตอนเที่ยงจึงน้อยลงเล็กน้อย",AmazonFishingParkPattayaพทยาไทย,"https://maps.google.com/maps/api/staticmap?&channel=ta.desktop.attraction_review&zoom=12&size=416x722&scale=2&client=gme-tripadvisorinc&format=jpg&sensor=false&language=th_TH&center=12.775920,100.924110&maptype=roadmap&&markers=icon:http%3A%2F%2Fc1.tacdn.com%2F%2Fimg2%2Fmaps%2Ficons%2Ffusion_map%2Fv2%2Fattractions-standard.png|scale:2|12.777781,100.919922|12.767138,100.933350|12.787906,100.955322|12.749869,100.961761&&markers=icon:http%3A%2F%2Fc1.tacdn.com%2F%2Fimg2%2Fmaps%2Ficons%2Ffusion_map%2Fv2%2Fattractions-active-anchor.png|scale:2|12.775920,100.924110&&markers=icon:http%3A%2F%2Fc1.tacdn.com%2F%2Fimg2%2Fmaps%2Ficons%2Ffusion_map%2Fv2%2Frestaurants-standard.png|scale:2|12.786839,100.915695|12.786985,100.915733|12.788110,100.916862|12.771494,100.909012|12.790755,100.928467&map_id=c01884c8146ad115&signature=TpbFKtsPcJAxC7yTcozyJrY4fS8="
ไม่ถูก,ธ.ค. ค.ศ. 2017 • เดินทางคนเดียว,นี้เป็นเพียงเล็กน้อยแพ่ง แต่คุ้มค่าการเดินทางพวกเขามีผู้ช่วยประสบการณ์ที่รู้ว่าสิ่งที่วิธีการจับปลาให้เคล็ดลับเล็ก ๆ ที่คู่มือเท่าที่ฉันรู้ว่าพวกเขาให้อาหารกลางวันเราจับปลาดุกขนาดใหญ่และหางสีแดงไม่กี่นี้ สนุก แต่ในความซื่อสัตย์สุจริตทั้งหมดสำหรับเงินเพียงเล็กน้อยคุณสามารถใช้วันออกประมงในเรือใกล้ท่าเรือพัทยานี้สนุกมากขึ้น!,AmazonFishingParkPattayaพทยาไทย,"https://maps.google.com/maps/api/staticmap?&channel=ta.desktop.attraction_review&zoom=12&size=416x722&scale=2&client=gme-tripadvisorinc&format=jpg&sensor=false&language=th_TH&center=12.775920,100.924110&maptype=roadmap&&markers=icon:http%3A%2F%2Fc1.tacdn.com%2F%2Fimg2%2Fmaps%2Ficons%2Ffusion_map%2Fv2%2Fattractions-standard.png|scale:2|12.777781,100.919922|12.767138,100.933350|12.787906,100.955322|12.749869,100.961761&&markers=icon:http%3A%2F%2Fc1.tacdn.com%2F%2Fimg2%2Fmaps%2Ficons%2Ffusion_map%2Fv2%2Fattractions-active-anchor.png|scale:2|12.775920,100.924110&&markers=icon:http%3A%2F%2Fc1.tacdn.com%2F%2Fimg2%2Fmaps%2Ficons%2Ffusion_map%2Fv2%2Frestaurants-standard.png|scale:2|12.786839,100.915695|12.786985,100.915733|12.788110,100.916862|12.771494,100.909012|12.790755,100.928467&map_id=c01884c8146ad115&signature=TpbFKtsPcJAxC7yTcozyJrY4fS8="
วันดีที่อุทยานตกปลาคุณภาพ,พ.ย. ค.ศ. 2017,"อเมซอนเป็นสวนประมงที่น่าสนใจที่สุดที่ฉันได้ไปเยี่ยมชมในหลายปีของการตกปลาทั่วประเทศไทย เป็นคนเดียวที่นำองค์ประกอบทั้งหมดเข้าด้วยกันในที่เดียว ประการแรกมันมีปลา: มีสายพันธุ์เอเชียและอเมริกาใต้มากกว่าหนึ่งโหล บางส่วนเป็นปลาใหญ่เช่นแมวโขงที่มีน้ำหนักไม่เกิน 40 กิโลกรัมและอร่าปาอิมา 60 ปลาที่ใหญ่ที่สุดที่ฉันเห็นมีที่ดินคือ 19 ปลาสยามประมาณ 5 กิโลกรัม แต่ปลาที่ใหญ่โตกัดเราตลอดทั้งวันหมุนวนที่ผิวสร้างเดือดและบางครั้งก็วิ่งเหยาะๆ กัดได้อย่างต่อเนื่องทุกวันช้าเวลา แต่ทุกคนจับปลา ฉันเป็นเจ้าของ Paccu ที่น้ำหนักประมาณ 7 กิโลกรัมซึ่งสูญเสียปลาบิ๊กไม่กี่ตัวที่ฉันไม่เคยเห็นมาและได้ทำร้ายเหยื่อเหล็กกล้าโดยไม่ได้รับความเมตตาตลอดทั้งวัน

ขอบคุณการตั้งค่าบางครั้งช่วงเวลาของการตกปลาช้ายังเป็นที่พอใจมาก สวนแห่งนี้สร้างขึ้นรอบ ๆ บ่อเพาะเลี้ยงสัตว์น้ำเชิงนิเวศประมาณ 2 เฮกเตอร์ล้อมรอบไปด้วยต้นไม้ที่ร่มรื่นซึ่งปกคลุมไปด้วยพืชพรรณที่เขียวชอุ่มและมีพืชพรรณท้องถิ่นที่มีความหลากหลายมาก มันน่ารักตลอดทั้งวัน แต่ก็งดงามอย่างแท้จริงในช่วงเช้า ประมาณ 8 สถานีประมงจะกระจายรอบปริมณฑลทั้งหมดที่มีร่มเงาและที่นั่งที่สะดวกสบาย อีกหนึ่งคุณลักษณะที่ดี: สวนค่อนข้างไกลจากถนนใหญ่ ๆ คุณได้ยินเสียงการจราจรห่างไกลเป็นครั้งคราวถ้าคุณฟังเฉพาะ แต่ส่วนใหญ่มีเพียงเสียงลมเบา ๆ ผ่านต้นไม้และนกร้องเพลงรวมถึงครอบครัวของ Kingfishers ที่ทำให้บ้านของพวกเขาอยู่ที่นั่น

สิ่งต่อไปที่ทำให้ผมประทับใจคือคุณภาพของเฟือง แท่งและวงล้อมีคุณภาพดีและได้รับการบำรุงรักษาเป็นอย่างดี วงล้อเต็มไปด้วยเส้นใหม่ผู้นำได้ผูกไว้อย่างดีและอยู่ในสภาพสมบูรณ์ตะขอมีคม คุณสามารถขอบคุณ John สำหรับเรื่องนี้เจ้าของซึ่งเป็นตัวเองตลอดชีวิตชาวประมงมักมาก เหยื่อมีคุณภาพดีทั้งปลามังสวิรัติและปลากินสัตว์

บริการเข้ามาในระดับเดียวกัน ผู้เชี่ยวชาญด้านนี้รวมถึงผู้เชี่ยวชาญที่ติดตั้งอุปกรณ์และตรวจสอบอย่างต่อเนื่องระหว่างวันโดยเจ้าหน้าที่ต่างๆเพื่อให้แน่ใจว่าทุกสิ่งทุกอย่างเป็นสิ่งที่ดีที่สุดในการจับปลา แต่ก็เกินกว่านั้น ในขณะที่ปลาเริ่มเงียบลงในดวงอาทิตย์ในวันอาทิตย์เมนูของปรากฏอย่างน่าอัศจรรย์ เมนูที่ดี! กับอาหารตะวันตกและอาหารไทยแสนอร่อย ในรูปแบบอาหารของชาวประมงที่แท้จริงฉันเริ่มต้นด้วยปีกบางและน้ำแข็งเย็นสิงห์ เพื่อความสุขของฉันและด้วยทักษะของโยในห้องครัวปีกได้กลายเป็นสิ่งที่ดีที่สุดที่ฉันเคยมีในราชอาณาจักรไทย! ซื้อกระเทียมและเครื่องเทศไทยรสอร่อย แต่พวกเขามีอาหารจานหลักมากเกินไปและรวมอาหารเช้า เมื่อฉันมาถึงก่อนสองเริ่มต้นถูกนำมาเสิร์ฟจานใหญ่ที่มีอาหารเช้าแบบอังกฤษที่ปรุงสุกในบ้านดูดีกว่าที่ฉันเคยเห็นในโรงแรมหรือร้านอาหารใด ๆ โดยทั่วไปฉันไม่คิดว่าอาหารเป็นปัจจัยสำคัญในการประเมินอุทยานการประมง แต่ก็แน่ใจว่าจะเพิ่มมากขึ้นเมื่อดี!

สวนยังสามารถจัดเตรียมการเดินทางให้กับคุณ โยออกมาข้างนอกโรงแรม 5 นาทีก่อนถึงเวลาที่ได้รับการแต่งตั้งและพาฉันไปที่สวนแล้วก็ทิ้งฉันลงอีกครั้งในตอนท้ายของวัน

ขอแนะนำให้คุณจองล่วงหน้า ผมหวังว่าจะไปเยี่ยมเยือนในการเดินทางก่อนหน้านี้ไปพัทยา แต่พวกเขาจองเต็ม 3 - 4 วันล่วงหน้า วันหลังจากวันฮาโลวีนไม่มีปัญหา แต่ในช่วงไฮซีซั่นจะมีความคิดที่ดีที่จะแจ้งให้ทราบล่วงหน้าอย่างมากเท่าที่คุณสามารถทำได้ นำครีมกันแดดและสารยับยั้งข้อผิดพลาดในกรณีแล้วผ่อนคลายสำหรับวันที่สนุกอย่างสมบูรณ์",AmazonFishingParkPattayaพทยาไทย,"https://maps.google.com/maps/api/staticmap?&channel=ta.desktop.attraction_review&zoom=12&size=416x722&scale=2&client=gme-tripadvisorinc&format=jpg&sensor=false&language=th_TH&center=12.775920,100.924110&maptype=roadmap&&markers=icon:http%3A%2F%2Fc1.tacdn.com%2F%2Fimg2%2Fmaps%2Ficons%2Ffusion_map%2Fv2%2Fattractions-standard.png|scale:2|12.777781,100.919922|12.767138,100.933350|12.787906,100.955322|12.749869,100.961761&&markers=icon:http%3A%2F%2Fc1.tacdn.com%2F%2Fimg2%2Fmaps%2Ficons%2Ffusion_map%2Fv2%2Fattractions-active-anchor.png|scale:2|12.775920,100.924110&&markers=icon:http%3A%2F%2Fc1.tacdn.com%2F%2Fimg2%2Fmaps%2Ficons%2Ffusion_map%2Fv2%2Frestaurants-standard.png|scale:2|12.786839,100.915695|12.786985,100.915733|12.788110,100.916862|12.771494,100.909012|12.790755,100.928467&map_id=c01884c8146ad115&signature=TpbFKtsPcJAxC7yTcozyJrY4fS8="
