Dean Middleton wrote a review Dec 2013,10,"Beware,,,,,do not pay by card !!!!!",There was a review on here that warned before about paying with card.....but I thought what the hell and paid that way......This is the only transaction made by myself with this card in last 4 weeks as I was away......As with other person it seems they have skimmed card...seemed all fine....but suddenly unusual transactions started to appear !!! DO NOT PAY BY VISA OR ANY OTHER CARD AT THIS HOTEL !!! you have been warned !!!,"HONEY LODGE - Prices & Hotel Reviews (Pattaya, Thailand)","https://maps.google.com/maps/api/staticmap?&channel=ta.desktop.hotel_review&zoom=15&size=811x241&scale=1&client=gme-tripadvisorinc&format=jpg&sensor=false&language=en_US&center=12.934711,100.892021&maptype=roadmap&&markers=icon:http%3A%2F%2Fc1.tacdn.com%2F%2Fimg2%2Fmaps%2Ficons%2Fresponsive_map_pins_v2%2FH_Anchor_pin.png|12.934711,100.892021&&markers=icon:http%3A%2F%2Fc1.tacdn.com%2F%2Fimg2%2Fmaps%2Ficons%2Fcomponent_map_pins_v1%2FA_Pin_xs.png|12.934132,100.887672|12.934503,100.891907|12.937825,100.892319|12.934280,100.891502&&markers=icon:http%3A%2F%2Fc1.tacdn.com%2F%2Fimg2%2Fmaps%2Ficons%2Fcomponent_map_pins_v1%2FR_Pin_xs.png|12.934425,100.893944|12.935964,100.888329|12.934770,100.890045|12.931151,100.890053|12.935006,100.891457|12.934615,100.890152|12.935438,100.890152|12.934950,100.891464|12.936825,100.893097&&markers=icon:http%3A%2F%2Fc1.tacdn.com%2F%2Fimg2%2Fmaps%2Ficons%2Fcomponent_map_pins_v1%2FH_Pin_xs.png|12.938590,100.890793|12.938218,100.891045|12.932687,100.895325|12.937084,100.890457|12.937399,100.891861|12.933731,100.888527|12.938361,100.892754|12.934778,100.888260|12.934186,100.888176&signature=xzKDthfOfjmU00EQIjZ2Z2eib1w="
Tina N wrote a review Nov 2013,40,"Nice hotel, very good location, near walking street and beach","I just stayed there 1 night in Nov 2013, little surprise when the neighborhood look dirty but this hotel is very clean and mordern designed. Walk 2 mins to Walking Street and could enjoy entertainment paradise there :) So many bars and pubs, massage places. Quite far from shopping mall but actually we dont plan to shop in pattaya.","HONEY LODGE - Prices & Hotel Reviews (Pattaya, Thailand)","https://maps.google.com/maps/api/staticmap?&channel=ta.desktop.hotel_review&zoom=15&size=811x241&scale=1&client=gme-tripadvisorinc&format=jpg&sensor=false&language=en_US&center=12.934711,100.892021&maptype=roadmap&&markers=icon:http%3A%2F%2Fc1.tacdn.com%2F%2Fimg2%2Fmaps%2Ficons%2Fresponsive_map_pins_v2%2FH_Anchor_pin.png|12.934711,100.892021&&markers=icon:http%3A%2F%2Fc1.tacdn.com%2F%2Fimg2%2Fmaps%2Ficons%2Fcomponent_map_pins_v1%2FA_Pin_xs.png|12.934132,100.887672|12.934503,100.891907|12.937825,100.892319|12.934280,100.891502&&markers=icon:http%3A%2F%2Fc1.tacdn.com%2F%2Fimg2%2Fmaps%2Ficons%2Fcomponent_map_pins_v1%2FR_Pin_xs.png|12.934425,100.893944|12.935964,100.888329|12.934770,100.890045|12.931151,100.890053|12.935006,100.891457|12.934615,100.890152|12.935438,100.890152|12.934950,100.891464|12.936825,100.893097&&markers=icon:http%3A%2F%2Fc1.tacdn.com%2F%2Fimg2%2Fmaps%2Ficons%2Fcomponent_map_pins_v1%2FH_Pin_xs.png|12.938590,100.890793|12.938218,100.891045|12.932687,100.895325|12.937084,100.890457|12.937399,100.891861|12.933731,100.888527|12.938361,100.892754|12.934778,100.888260|12.934186,100.888176&signature=xzKDthfOfjmU00EQIjZ2Z2eib1w="
nyms43 wrote a review May 2013,40,Great Convinience With Upgraded Rooms,"Room has been upgraded but of caused it come will additional cost BHT 900/night.Location is the best, walking distance to walking street, beach, shopping malls, jetty to islands, wet market and lot or bars. Just at the entrance of the hotel there is Vans which take you direct to Bangkok which stops at Monument MRT station for BHT 100. Pool is quite deep not safe for children without parents around.","HONEY LODGE - Prices & Hotel Reviews (Pattaya, Thailand)","https://maps.google.com/maps/api/staticmap?&channel=ta.desktop.hotel_review&zoom=15&size=811x241&scale=1&client=gme-tripadvisorinc&format=jpg&sensor=false&language=en_US&center=12.934711,100.892021&maptype=roadmap&&markers=icon:http%3A%2F%2Fc1.tacdn.com%2F%2Fimg2%2Fmaps%2Ficons%2Fresponsive_map_pins_v2%2FH_Anchor_pin.png|12.934711,100.892021&&markers=icon:http%3A%2F%2Fc1.tacdn.com%2F%2Fimg2%2Fmaps%2Ficons%2Fcomponent_map_pins_v1%2FA_Pin_xs.png|12.934132,100.887672|12.934503,100.891907|12.937825,100.892319|12.934280,100.891502&&markers=icon:http%3A%2F%2Fc1.tacdn.com%2F%2Fimg2%2Fmaps%2Ficons%2Fcomponent_map_pins_v1%2FR_Pin_xs.png|12.934425,100.893944|12.935964,100.888329|12.934770,100.890045|12.931151,100.890053|12.935006,100.891457|12.934615,100.890152|12.935438,100.890152|12.934950,100.891464|12.936825,100.893097&&markers=icon:http%3A%2F%2Fc1.tacdn.com%2F%2Fimg2%2Fmaps%2Ficons%2Fcomponent_map_pins_v1%2FH_Pin_xs.png|12.938590,100.890793|12.938218,100.891045|12.932687,100.895325|12.937084,100.890457|12.937399,100.891861|12.933731,100.888527|12.938361,100.892754|12.934778,100.888260|12.934186,100.888176&signature=xzKDthfOfjmU00EQIjZ2Z2eib1w="
SteveJ617 wrote a review Apr 2013,10,Had my credit card details copied by the lady at reception,"Scammers at this hotel reception. Stay away from this place.  I recently stayed at the honey lodge  address 597/8 Moo 10 Nongprue Banglamung, Chonburi 20150.    On the 28 march I handed my credit card to the lady behind the counter to pay for my extra night stay at the hotel. I watched her place the card in a credit card type reader then look at her computer. She then said ""must waiting"" I said ""ok"". Two to three minutes later she said ""still waiting you come back later leave card"". This to me was very suspicious behaviour that she would ask me to leave my credit card with her. I said no and asked for the card back. My credit card had been in this reader device the whole time about two to three minutes. On 29 march around 10am I logged onto net banking and noticed unusual transactions on my credit card I notified the bank immediately and they confirmed that the card had been compromised to the value of around $5000 AUD.  This is the only time I attempted to use the card the whole trip and the only opportunity for someone to copy my card information. I believe that the lady behind reception is coping people's credit card details then returning the card to the owner without a record of a transaction. The bank would have no record of a transaction at the honey hotel yet she has a copy of the card details.","HONEY LODGE - Prices & Hotel Reviews (Pattaya, Thailand)","https://maps.google.com/maps/api/staticmap?&channel=ta.desktop.hotel_review&zoom=15&size=811x241&scale=1&client=gme-tripadvisorinc&format=jpg&sensor=false&language=en_US&center=12.934711,100.892021&maptype=roadmap&&markers=icon:http%3A%2F%2Fc1.tacdn.com%2F%2Fimg2%2Fmaps%2Ficons%2Fresponsive_map_pins_v2%2FH_Anchor_pin.png|12.934711,100.892021&&markers=icon:http%3A%2F%2Fc1.tacdn.com%2F%2Fimg2%2Fmaps%2Ficons%2Fcomponent_map_pins_v1%2FA_Pin_xs.png|12.934132,100.887672|12.934503,100.891907|12.937825,100.892319|12.934280,100.891502&&markers=icon:http%3A%2F%2Fc1.tacdn.com%2F%2Fimg2%2Fmaps%2Ficons%2Fcomponent_map_pins_v1%2FR_Pin_xs.png|12.934425,100.893944|12.935964,100.888329|12.934770,100.890045|12.931151,100.890053|12.935006,100.891457|12.934615,100.890152|12.935438,100.890152|12.934950,100.891464|12.936825,100.893097&&markers=icon:http%3A%2F%2Fc1.tacdn.com%2F%2Fimg2%2Fmaps%2Ficons%2Fcomponent_map_pins_v1%2FH_Pin_xs.png|12.938590,100.890793|12.938218,100.891045|12.932687,100.895325|12.937084,100.890457|12.937399,100.891861|12.933731,100.888527|12.938361,100.892754|12.934778,100.888260|12.934186,100.888176&signature=xzKDthfOfjmU00EQIjZ2Z2eib1w="
Madjid A wrote a review Feb 2013,40,"Great Value, New with a modern flair, Clean Hotel with a great Location and a small Poll",A few steps to Walking Street and a major Pattaya intersetion yet surprinsingly quiet. Rooms are rather small and the bed is barely enough for two (but for one it is plenty enough). However some have partial sea view and a balcony. Excellent value if you are not looking for great comfort. The small pool is a welcome sight and may even be usable.,"HONEY LODGE - Prices & Hotel Reviews (Pattaya, Thailand)","https://maps.google.com/maps/api/staticmap?&channel=ta.desktop.hotel_review&zoom=15&size=811x241&scale=1&client=gme-tripadvisorinc&format=jpg&sensor=false&language=en_US&center=12.934711,100.892021&maptype=roadmap&&markers=icon:http%3A%2F%2Fc1.tacdn.com%2F%2Fimg2%2Fmaps%2Ficons%2Fresponsive_map_pins_v2%2FH_Anchor_pin.png|12.934711,100.892021&&markers=icon:http%3A%2F%2Fc1.tacdn.com%2F%2Fimg2%2Fmaps%2Ficons%2Fcomponent_map_pins_v1%2FA_Pin_xs.png|12.934132,100.887672|12.934503,100.891907|12.937825,100.892319|12.934280,100.891502&&markers=icon:http%3A%2F%2Fc1.tacdn.com%2F%2Fimg2%2Fmaps%2Ficons%2Fcomponent_map_pins_v1%2FR_Pin_xs.png|12.934425,100.893944|12.935964,100.888329|12.934770,100.890045|12.931151,100.890053|12.935006,100.891457|12.934615,100.890152|12.935438,100.890152|12.934950,100.891464|12.936825,100.893097&&markers=icon:http%3A%2F%2Fc1.tacdn.com%2F%2Fimg2%2Fmaps%2Ficons%2Fcomponent_map_pins_v1%2FH_Pin_xs.png|12.938590,100.890793|12.938218,100.891045|12.932687,100.895325|12.937084,100.890457|12.937399,100.891861|12.933731,100.888527|12.938361,100.892754|12.934778,100.888260|12.934186,100.888176&signature=xzKDthfOfjmU00EQIjZ2Z2eib1w="
Chang Noi wrote a review Jan 2013,30,"Small, recently renovated hotel near Walkingstreet","Within 2min walking from Walkingstreet and beach road. And smaller hotel that has just been renovated. Actually good value for money. Too bad that they did not put in new towels and bed.    They have a small swimming pool. For the walking-in price I paid breakfast was not included (although I think they did not tell me that at check-in). Never the less, the 100thb for the continental breakfast is a waste of money. Better get an good breakfast somewhere else.    Otherwise the rooms is good, clean and comfortable.","HONEY LODGE - Prices & Hotel Reviews (Pattaya, Thailand)","https://maps.google.com/maps/api/staticmap?&channel=ta.desktop.hotel_review&zoom=15&size=811x241&scale=1&client=gme-tripadvisorinc&format=jpg&sensor=false&language=en_US&center=12.934711,100.892021&maptype=roadmap&&markers=icon:http%3A%2F%2Fc1.tacdn.com%2F%2Fimg2%2Fmaps%2Ficons%2Fresponsive_map_pins_v2%2FH_Anchor_pin.png|12.934711,100.892021&&markers=icon:http%3A%2F%2Fc1.tacdn.com%2F%2Fimg2%2Fmaps%2Ficons%2Fcomponent_map_pins_v1%2FA_Pin_xs.png|12.934132,100.887672|12.934503,100.891907|12.937825,100.892319|12.934280,100.891502&&markers=icon:http%3A%2F%2Fc1.tacdn.com%2F%2Fimg2%2Fmaps%2Ficons%2Fcomponent_map_pins_v1%2FR_Pin_xs.png|12.934425,100.893944|12.935964,100.888329|12.934770,100.890045|12.931151,100.890053|12.935006,100.891457|12.934615,100.890152|12.935438,100.890152|12.934950,100.891464|12.936825,100.893097&&markers=icon:http%3A%2F%2Fc1.tacdn.com%2F%2Fimg2%2Fmaps%2Ficons%2Fcomponent_map_pins_v1%2FH_Pin_xs.png|12.938590,100.890793|12.938218,100.891045|12.932687,100.895325|12.937084,100.890457|12.937399,100.891861|12.933731,100.888527|12.938361,100.892754|12.934778,100.888260|12.934186,100.888176&signature=xzKDthfOfjmU00EQIjZ2Z2eib1w="
justyannis wrote a review Dec 2012,50,The best place to stay in Pattaya,"Totally renovated,clean,right in the center,just outside of Walking Street,has pool,nice staff that speaks good English,good service,quiet and value for money.Food was good also.I have no complains at all.  I've been many times in Pattaya and stayed in different places.This one is my favorite.It costs 900baht per night and for such a room+pool is great price,especially if you compare with similar price hotels.  I definately recommend it and definately will stay there again!","HONEY LODGE - Prices & Hotel Reviews (Pattaya, Thailand)","https://maps.google.com/maps/api/staticmap?&channel=ta.desktop.hotel_review&zoom=15&size=811x241&scale=1&client=gme-tripadvisorinc&format=jpg&sensor=false&language=en_US&center=12.934711,100.892021&maptype=roadmap&&markers=icon:http%3A%2F%2Fc1.tacdn.com%2F%2Fimg2%2Fmaps%2Ficons%2Fresponsive_map_pins_v2%2FH_Anchor_pin.png|12.934711,100.892021&&markers=icon:http%3A%2F%2Fc1.tacdn.com%2F%2Fimg2%2Fmaps%2Ficons%2Fcomponent_map_pins_v1%2FA_Pin_xs.png|12.934132,100.887672|12.934503,100.891907|12.937825,100.892319|12.934280,100.891502&&markers=icon:http%3A%2F%2Fc1.tacdn.com%2F%2Fimg2%2Fmaps%2Ficons%2Fcomponent_map_pins_v1%2FR_Pin_xs.png|12.934425,100.893944|12.935964,100.888329|12.934770,100.890045|12.931151,100.890053|12.935006,100.891457|12.934615,100.890152|12.935438,100.890152|12.934950,100.891464|12.936825,100.893097&&markers=icon:http%3A%2F%2Fc1.tacdn.com%2F%2Fimg2%2Fmaps%2Ficons%2Fcomponent_map_pins_v1%2FH_Pin_xs.png|12.938590,100.890793|12.938218,100.891045|12.932687,100.895325|12.937084,100.890457|12.937399,100.891861|12.933731,100.888527|12.938361,100.892754|12.934778,100.888260|12.934186,100.888176&signature=xzKDthfOfjmU00EQIjZ2Z2eib1w="
nyms43 wrote a review Sep 2012,40,Convinience happening area,"Hotel and pool has just been renovated, so everything is new and of caused the price too, before was BHT 600 now BHT 900. Walking distance to Walking Street where all the bar is, and jetty to another nearby island for BHT 15, remember to bring water and some food to eat or you will have to pay extra price for everything on the island (good far 1 lazy day trip), taxi to Survarnabumi airport at BHT 800 or you can take the shuttle van just front of the hotel to Monument MRT for BHT 100, take another MRT for another station for BHT 15 which will connect you to Airport MRT for BHT 45. Not so hassle but very cheap. Out of the entrance on the left walk straight about 100 meters you will find a big temple and an interesting market with lot of local foods and cheap too. Everything is walking distance to discover.","HONEY LODGE - Prices & Hotel Reviews (Pattaya, Thailand)","https://maps.google.com/maps/api/staticmap?&channel=ta.desktop.hotel_review&zoom=15&size=811x241&scale=1&client=gme-tripadvisorinc&format=jpg&sensor=false&language=en_US&center=12.934711,100.892021&maptype=roadmap&&markers=icon:http%3A%2F%2Fc1.tacdn.com%2F%2Fimg2%2Fmaps%2Ficons%2Fresponsive_map_pins_v2%2FH_Anchor_pin.png|12.934711,100.892021&&markers=icon:http%3A%2F%2Fc1.tacdn.com%2F%2Fimg2%2Fmaps%2Ficons%2Fcomponent_map_pins_v1%2FA_Pin_xs.png|12.934132,100.887672|12.934503,100.891907|12.937825,100.892319|12.934280,100.891502&&markers=icon:http%3A%2F%2Fc1.tacdn.com%2F%2Fimg2%2Fmaps%2Ficons%2Fcomponent_map_pins_v1%2FR_Pin_xs.png|12.934425,100.893944|12.935964,100.888329|12.934770,100.890045|12.931151,100.890053|12.935006,100.891457|12.934615,100.890152|12.935438,100.890152|12.934950,100.891464|12.936825,100.893097&&markers=icon:http%3A%2F%2Fc1.tacdn.com%2F%2Fimg2%2Fmaps%2Ficons%2Fcomponent_map_pins_v1%2FH_Pin_xs.png|12.938590,100.890793|12.938218,100.891045|12.932687,100.895325|12.937084,100.890457|12.937399,100.891861|12.933731,100.888527|12.938361,100.892754|12.934778,100.888260|12.934186,100.888176&signature=xzKDthfOfjmU00EQIjZ2Z2eib1w="
